<!ELEMENT Library (Book,Menber)>

<!ELEMENT Book (Title,Author,Price,Publisher,Cost)>

<!ELEMENT Member (Name,Address)>

<!ELEMENT Name (FirstName,MiddleName,LastName)>
<!ELEMENT Address (HouseNumber,Street,City)>

<!ELEMENT Title (#PCDATA)>
<!ELEMENT Author (#PCDATA)>
<!ELEMENT Price (#PCDATA)>
<!ELEMENT Publisher (#PCDATA)>
<!ELEMENT Cost (#PCDATA)>

<!ELEMENT FirstName (#PCDATA)>
<!ELEMENT MiddleName (#PCDATA)>
<!ELEMENT LastName (#PCDATA)>
<!ELEMENT HouseNumber (#PCDATA)>
<!ELEMENT Street (#PCDATA)>
<!ELEMENT City (#PCDATA)>
<!ATTLIST Book
    Bookid CDATA #REQUIRED
>